{
  "schema_version": "1.0",
  "id": "20000000-0000-4000-8000-000000000002",
  "tenant_id": "10000000-0000-4000-8000-000000000001",
  "external_identity_id": "lead-identity-synthetic-001",
  "status": "active",
  "adapter_metadata": {
    "source_channel": "whatsapp"
  },
  "created_at": "2026-07-12T08:00:00.000Z",
  "updated_at": "2026-07-12T08:30:00.000Z"
}
